{
  "id": "000000000000000000000000000000a1",
  "name": "Screenshot 2026-10-04.png",
  "kind": "image",
  "bytes": 72,
  "path": "/home/user/.local/state/omodachi/uploads/agent-20260915T000000Z-000000000000000000000000000000a1.png",
  "media_type": "image/png",
  "expires_at": "2026-09-22T00:00:00Z",
  "contract_revision": "omodachi.v1"
}
