{
  "id": "000000000000000000000000000000a2",
  "name": "main.py",
  "kind": "text",
  "bytes": 15,
  "path": "/home/user/.local/state/omodachi/uploads/herdr-20260915T000000Z-000000000000000000000000000000a2.py",
  "media_type": "text/plain",
  "expires_at": "2026-09-22T00:00:00Z",
  "contract_revision": "omodachi.v1"
}
