{
  "id": "000000000000000000000000000000a3",
  "name": "notes.pdf",
  "kind": "pdf",
  "bytes": 18,
  "path": "/home/user/.local/state/omodachi/uploads/agent-20260915T000000Z-000000000000000000000000000000a3.pdf",
  "media_type": "application/pdf",
  "expires_at": "2026-09-22T00:00:00Z",
  "contract_revision": "omodachi.v1"
}
